{"$schema":"https://json-schema.org/draft/2020-12/schema","type":"object","required":["schemaVersion","parser","pageCount","metadata","markInfo","outlines","pages"],"properties":{"schemaVersion":{"const":1},"parser":{"type":"object","required":["name","version"],"properties":{"name":{"const":"pdfjs-dist"},"version":{"const":"5.4.624"}}},"pageCount":{"type":"integer","minimum":1},"metadata":{"type":"object","required":["info","hasStructTree"],"properties":{"info":{"type":"object","required":["Title","Author","Language"]},"hasStructTree":{"const":true}}},"markInfo":{"type":"object","required":["Marked"],"properties":{"Marked":{"const":true}}},"outlines":{"type":"array","minItems":1},"pages":{"type":"array","minItems":1,"items":{"type":"object","required":["pageNumber","view","annotations","structTree","text"],"properties":{"pageNumber":{"type":"integer","minimum":1},"view":{"type":"array","minItems":4},"annotations":{"type":"array"},"structTree":{"type":"object"},"text":{"type":"object","required":["language","fontNames","fontFamilies"],"properties":{"language":{"const":"en-US"},"fontNames":{"type":"array","minItems":1},"fontFamilies":{"type":"array","minItems":1}}}}}}}}
